{
  "schemaVersion": 1,
  "site": {
    "name": "Synthetic Lisbon Site",
    "collectedAt": "2026-09-28T12:00:00Z",
    "source": "synthetic",
    "collectorVersion": "0.1.0",
    "pseudonymized": false
  },
  "directory": {
    "users": [
      {
        "sid": "S-1-5-21-1004336348-1177238915-682003330-2001",
        "name": "CORP\\ana.alves",
        "displayName": "Ana Alves",
        "enabled": true
      },
      {
        "sid": "S-1-5-21-1004336348-1177238915-682003330-2002",
        "name": "CORP\\bruno.barros",
        "displayName": "Bruno Barros",
        "enabled": true
      },
      {
        "sid": "S-1-5-21-1004336348-1177238915-682003330-2003",
        "name": "CORP\\carla.costa",
        "displayName": "Carla Costa",
        "enabled": true
      },
      {
        "sid": "S-1-5-21-1004336348-1177238915-682003330-2004",
        "name": "CORP\\diego.duarte",
        "displayName": "Diego Duarte",
        "enabled": true
      },
      {
        "sid": "S-1-5-21-1004336348-1177238915-682003330-2005",
        "name": "CORP\\elena.esteves",
        "displayName": "Elena Esteves",
        "enabled": true
      },
      {
        "sid": "S-1-5-21-1004336348-1177238915-682003330-2006",
        "name": "CORP\\filipe.faria",
        "displayName": "Filipe Faria",
        "enabled": true
      },
      {
        "sid": "S-1-5-21-1004336348-1177238915-682003330-2007",
        "name": "CORP\\grace.gomes",
        "displayName": "Grace Gomes",
        "enabled": true
      },
      {
        "sid": "S-1-5-21-1004336348-1177238915-682003330-2008",
        "name": "CORP\\hugo.henriques",
        "displayName": "Hugo Henriques",
        "enabled": true
      },
      {
        "sid": "S-1-5-21-1004336348-1177238915-682003330-2009",
        "name": "CORP\\ines.alves",
        "displayName": "Ines Alves",
        "enabled": true
      },
      {
        "sid": "S-1-5-21-1004336348-1177238915-682003330-2010",
        "name": "CORP\\joao.barros",
        "displayName": "Joao Barros",
        "enabled": false
      },
      {
        "sid": "S-1-5-21-1004336348-1177238915-682003330-2011",
        "name": "CORP\\karin.costa",
        "displayName": "Karin Costa",
        "enabled": true
      },
      {
        "sid": "S-1-5-21-1004336348-1177238915-682003330-2012",
        "name": "CORP\\luis.duarte",
        "displayName": "Luis Duarte",
        "enabled": true
      },
      {
        "sid": "S-1-5-21-1004336348-1177238915-682003330-2013",
        "name": "CORP\\marta.esteves",
        "displayName": "Marta Esteves",
        "enabled": true
      },
      {
        "sid": "S-1-5-21-1004336348-1177238915-682003330-2014",
        "name": "CORP\\nuno.faria",
        "displayName": "Nuno Faria",
        "enabled": true
      },
      {
        "sid": "S-1-5-21-1004336348-1177238915-682003330-2015",
        "name": "CORP\\olga.gomes",
        "displayName": "Olga Gomes",
        "enabled": true
      },
      {
        "sid": "S-1-5-21-1004336348-1177238915-682003330-2016",
        "name": "CORP\\pedro.henriques",
        "displayName": "Pedro Henriques",
        "enabled": true
      },
      {
        "sid": "S-1-5-21-1004336348-1177238915-682003330-2017",
        "name": "CORP\\rita.alves",
        "displayName": "Rita Alves",
        "enabled": true
      },
      {
        "sid": "S-1-5-21-1004336348-1177238915-682003330-2018",
        "name": "CORP\\samuel.barros",
        "displayName": "Samuel Barros",
        "enabled": true
      },
      {
        "sid": "S-1-5-21-1004336348-1177238915-682003330-2019",
        "name": "CORP\\tania.costa",
        "displayName": "Tania Costa",
        "enabled": true
      },
      {
        "sid": "S-1-5-21-1004336348-1177238915-682003330-2020",
        "name": "CORP\\victor.duarte",
        "displayName": "Victor Duarte",
        "enabled": true
      },
      {
        "sid": "S-1-5-21-1004336348-1177238915-682003330-2021",
        "name": "CORP\\wanda.esteves",
        "displayName": "Wanda Esteves",
        "enabled": true
      },
      {
        "sid": "S-1-5-21-1004336348-1177238915-682003330-2022",
        "name": "CORP\\xavier.faria",
        "displayName": "Xavier Faria",
        "enabled": true
      },
      {
        "sid": "S-1-5-21-1004336348-1177238915-682003330-2023",
        "name": "CORP\\yara.gomes",
        "displayName": "Yara Gomes",
        "enabled": true
      },
      {
        "sid": "S-1-5-21-1004336348-1177238915-682003330-2024",
        "name": "CORP\\zeca.henriques",
        "displayName": "Zeca Henriques",
        "enabled": true
      },
      {
        "sid": "S-1-5-21-1004336348-1177238915-682003330-2025",
        "name": "CORP\\alice.alves",
        "displayName": "Alice Alves",
        "enabled": true
      },
      {
        "sid": "S-1-5-21-1004336348-1177238915-682003330-2026",
        "name": "CORP\\bernardo.barros",
        "displayName": "Bernardo Barros",
        "enabled": true
      },
      {
        "sid": "S-1-5-21-1004336348-1177238915-682003330-2027",
        "name": "CORP\\clara.costa",
        "displayName": "Clara Costa",
        "enabled": true
      },
      {
        "sid": "S-1-5-21-1004336348-1177238915-682003330-2028",
        "name": "CORP\\daniel.duarte",
        "displayName": "Daniel Duarte",
        "enabled": true
      },
      {
        "sid": "S-1-5-21-1004336348-1177238915-682003330-2029",
        "name": "CORP\\eva.esteves",
        "displayName": "Eva Esteves",
        "enabled": true
      },
      {
        "sid": "S-1-5-21-1004336348-1177238915-682003330-2030",
        "name": "CORP\\fabio.faria",
        "displayName": "Fabio Faria",
        "enabled": true
      },
      {
        "sid": "S-1-5-21-1004336348-1177238915-682003330-2031",
        "name": "CORP\\gil.gomes",
        "displayName": "Gil Gomes",
        "enabled": true
      },
      {
        "sid": "S-1-5-21-1004336348-1177238915-682003330-2032",
        "name": "CORP\\helena.henriques",
        "displayName": "Helena Henriques",
        "enabled": true
      },
      {
        "sid": "S-1-5-21-1004336348-1177238915-682003330-2033",
        "name": "CORP\\ana.barros",
        "displayName": "Ana Barros",
        "enabled": true
      },
      {
        "sid": "S-1-5-21-1004336348-1177238915-682003330-2034",
        "name": "CORP\\bruno.costa",
        "displayName": "Bruno Costa",
        "enabled": true
      },
      {
        "sid": "S-1-5-21-1004336348-1177238915-682003330-2035",
        "name": "CORP\\carla.duarte",
        "displayName": "Carla Duarte",
        "enabled": true
      },
      {
        "sid": "S-1-5-21-1004336348-1177238915-682003330-2036",
        "name": "CORP\\diego.esteves",
        "displayName": "Diego Esteves",
        "enabled": false
      },
      {
        "sid": "S-1-5-21-1004336348-1177238915-682003330-2037",
        "name": "CORP\\elena.faria",
        "displayName": "Elena Faria",
        "enabled": true
      },
      {
        "sid": "S-1-5-21-1004336348-1177238915-682003330-2038",
        "name": "CORP\\filipe.gomes",
        "displayName": "Filipe Gomes",
        "enabled": true
      },
      {
        "sid": "S-1-5-21-1004336348-1177238915-682003330-2039",
        "name": "CORP\\grace.henriques",
        "displayName": "Grace Henriques",
        "enabled": true
      },
      {
        "sid": "S-1-5-21-1004336348-1177238915-682003330-2040",
        "name": "CORP\\hugo.alves",
        "displayName": "Hugo Alves",
        "enabled": true
      },
      {
        "sid": "S-1-5-21-1004336348-1177238915-682003330-2041",
        "name": "CORP\\ines.barros",
        "displayName": "Ines Barros",
        "enabled": true
      },
      {
        "sid": "S-1-5-21-1004336348-1177238915-682003330-2042",
        "name": "CORP\\joao.costa",
        "displayName": "Joao Costa",
        "enabled": true
      },
      {
        "sid": "S-1-5-21-1004336348-1177238915-682003330-2043",
        "name": "CORP\\karin.duarte",
        "displayName": "Karin Duarte",
        "enabled": true
      },
      {
        "sid": "S-1-5-21-1004336348-1177238915-682003330-2044",
        "name": "CORP\\luis.esteves",
        "displayName": "Luis Esteves",
        "enabled": true
      },
      {
        "sid": "S-1-5-21-1004336348-1177238915-682003330-2045",
        "name": "CORP\\marta.faria",
        "displayName": "Marta Faria",
        "enabled": true
      },
      {
        "sid": "S-1-5-21-1004336348-1177238915-682003330-2046",
        "name": "CORP\\nuno.gomes",
        "displayName": "Nuno Gomes",
        "enabled": true
      },
      {
        "sid": "S-1-5-21-1004336348-1177238915-682003330-2047",
        "name": "CORP\\olga.henriques",
        "displayName": "Olga Henriques",
        "enabled": true
      },
      {
        "sid": "S-1-5-21-1004336348-1177238915-682003330-2048",
        "name": "CORP\\pedro.alves",
        "displayName": "Pedro Alves",
        "enabled": true
      },
      {
        "sid": "S-1-5-21-1004336348-1177238915-682003330-2049",
        "name": "CORP\\rita.barros",
        "displayName": "Rita Barros",
        "enabled": true
      },
      {
        "sid": "S-1-5-21-1004336348-1177238915-682003330-2050",
        "name": "CORP\\samuel.costa",
        "displayName": "Samuel Costa",
        "enabled": true
      },
      {
        "sid": "S-1-5-21-1004336348-1177238915-682003330-2051",
        "name": "CORP\\tania.duarte",
        "displayName": "Tania Duarte",
        "enabled": true
      },
      {
        "sid": "S-1-5-21-1004336348-1177238915-682003330-2052",
        "name": "CORP\\victor.esteves",
        "displayName": "Victor Esteves",
        "enabled": true
      },
      {
        "sid": "S-1-5-21-1004336348-1177238915-682003330-2053",
        "name": "CORP\\wanda.faria",
        "displayName": "Wanda Faria",
        "enabled": true
      },
      {
        "sid": "S-1-5-21-1004336348-1177238915-682003330-2054",
        "name": "CORP\\xavier.gomes",